13:58:24.547450 IP lamponubuntu2004-s-1vcpu-1gb-amd-blr1-01.ssh > 162.243.190.66.43113: Flags [P.], seq 226528:227152, ack 193, win 501, options [nop,nop,TS val 3353624774 ecr 557599868], length 624
13:58:24.547493 IP lamponubuntu2004-s-1vcpu-1gb-amd-blr1-01.ssh > 162.243.190.66.43113: Flags [P.], seq 227152:227408, ack 193, win 501, options [nop,nop,TS val 3353624774 ecr 557599868], length 256
13:58:24.547530 IP lamponubuntu2004-s-1vcpu-1gb-amd-blr1-01.ssh > 162.243.190.66.43113: Flags [P.], seq 227408:227664, ack 193, win 501, options [nop,nop,TS val 3353624774 ecr 557599868], length 256
13:58:24.547542 IP 162.243.190.66.43113 > lamponubuntu2004-s-1vcpu-1gb-amd-blr1-01.ssh: Flags [.], ack 144784, win 2005, options [nop,nop,TS val 557599868 ecr 3353624479], length 0
13:58:24.547589 IP lamponubuntu2004-s-1vcpu-1gb-amd-blr1-01.ssh > 162.243.190.66.43113: Flags [P.], seq 227664:228096, ack 193, win 501, options [nop,nop,TS val 3353624774 ecr 557599868], length 432
13:58:24.547628 IP lamponubuntu2004-s-1vcpu-1gb-amd-blr1-01.ssh > 162.243.190.66.43113: Flags [P.], seq 228096:228352, ack 193, win 501, options [nop,nop,TS val 3353624774 ecr 557599868], length 256
13:58:24.547663 IP lamponubuntu2004-s-1vcpu-1gb-amd-blr1-01.ssh > 162.243.190.66.43113: Flags [P.], seq 228352:228608, ack 193, win 501, options [nop,nop,TS val 3353624774 ecr 557599868], length 256
13:58:24.547699 IP lamponubuntu2004-s-1vcpu-1gb-amd-blr1-01.ssh > 162.243.190.66.43113: Flags [P.], seq 228608:228864, ack 193, win 501, options [nop,nop,TS val 3353624774 ecr 557599868], length 256
13:58:24.547735 IP lamponubuntu2004-s-1vcpu-1gb-amd-blr1-01.ssh > 162.243.190.66.43113: Flags [P.], seq 228864:229120, ack 193, win 501, options [nop,nop,TS val 3353624774 ecr 557599868], length 256
13:58:24.547772 IP lamponubuntu2004-s-1vcpu-1gb-amd-blr1-01.ssh > 162.243.190.66.43113: Flags [P.], seq 229120:229376, ack 193, win 501, options [nop,nop,TS val 3353624774 ecr 557599868], length 256
13:58:24.547814 IP lamponubuntu2004-s-1vcpu-1gb-amd-blr1-01.ssh > 162.243.190.66.43113: Flags [P.], seq 229376:229632, ack 193, win 501, options [nop,nop,TS val 3353624774 ecr 557599868], length 256
13:58:24.547841 IP 162.243.190.66.43113 > lamponubuntu2004-s-1vcpu-1gb-amd-blr1-01.ssh: Flags [.], ack 145808, win 2005, options [nop,nop,TS val 557599868 ecr 3353624479], length 0
13:58:24.547873 IP lamponubuntu2004-s-1vcpu-1gb-amd-blr1-01.ssh > 162.243.190.66.43113: Flags [P.], seq 229632:230064, ack 193, win 501, options [nop,nop,TS val 3353624775 ecr 557599868], length 432
13:58:24.547911 IP lamponubuntu2004-s-1vcpu-1gb-amd-blr1-01.ssh > 162.243.190.66.43113: Flags [P.], seq 230064:230320, ack 193, win 501, options [nop,nop,TS val 3353624775 ecr 557599868], length 256
13:58:24.547966 IP lamponubuntu2004-s-1vcpu-1gb-amd-blr1-01.ssh > 162.243.190.66.43113: Flags [P.], seq 230320:230576, ack 193, win 501, options [nop,nop,TS val 3353624775 ecr 557599868], length 256
13:58:24.548024 IP lamponubuntu2004-s-1vcpu-1gb-amd-blr1-01.ssh > 162.243.190.66.43113: Flags [P.], seq 230576:230832, ack 193, win 501, options [nop,nop,TS val 3353624775 ecr 557599868], length 256
13:58:24.548064 IP lamponubuntu2004-s-1vcpu-1gb-amd-blr1-01.ssh > 162.243.190.66.43113: Flags [P.], seq 230832:231088, ack 193, win 501, options [nop,nop,TS val 3353624775 ecr 557599868], length 256
13:58:24.548101 IP lamponubuntu2004-s-1vcpu-1gb-amd-blr1-01.ssh > 162.243.190.66.43113: Flags [P.], seq 231088:231344, ack 193, win 501, options [nop,nop,TS val 3353624775 ecr 557599868], length 256
13:58:24.548138 IP lamponubuntu2004-s-1vcpu-1gb-amd-blr1-01.ssh > 162.243.190.66.43113: Flags [P.], seq 231344:231600, ack 193, win 501, options [nop,nop,TS val 3353624775 ecr 557599868], length 256
13:58:24.548174 IP lamponubuntu2004-s-1vcpu-1gb-amd-blr1-01.ssh > 162.243.190.66.43113: Flags [P.], seq 231600:231856, ack 193, win 501, options [nop,nop,TS val 3353624775 ecr 557599868], length 256
13:58:24.548210 IP lamponubuntu2004-s-1vcpu-1gb-amd-blr1-01.ssh > 162.243.190.66.43113: Flags [P.], seq 231856:232112, ack 193, win 501, options [nop,nop,TS val 3353624775 ecr 557599868], length 256
13:58:24.548273 IP lamponubuntu2004-s-1vcpu-1gb-amd-blr1-01.ssh > 162.243.190.66.43113: Flags [P.], seq 232112:232368, ack 193, win 501, options [nop,nop,TS val 3353624775 ecr 557599868], length 256
13:58:24.548317 IP lamponubuntu2004-s-1vcpu-1gb-amd-blr1-01.ssh > 162.243.190.66.43113: Flags [P.], seq 232368:232624, ack 193, win 501, options [nop,nop,TS val 3353624775 ecr 557599868], length 256
13:58:24.548356 IP lamponubuntu2004-s-1vcpu-1gb-amd-blr1-01.ssh > 162.243.190.66.43113: Flags [P.], seq 232624:232880, ack 193, win 501, options [nop,nop,TS val 3353624775 ecr 557599868], length 256
13:58:24.548393 IP lamponubuntu2004-s-1vcpu-1gb-amd-blr1-01.ssh > 162.243.190.66.43113: Flags [P.], seq 232880:233136, ack 193, win 501, options [nop,nop,TS val 3353624775 ecr 557599868], length 256
13:58:24.548430 IP lamponubuntu2004-s-1vcpu-1gb-amd-blr1-01.ssh > 162.243.190.66.43113: Flags [P.], seq 233136:233392, ack 193, win 501, options [nop,nop,TS val 3353624775 ecr 557599868], length 256
13:58:24.548467 IP lamponubuntu2004-s-1vcpu-1gb-amd-blr1-01.ssh > 162.243.190.66.43113: Flags [P.], seq 233392:233648, ack 193, win 501, options [nop,nop,TS val 3353624775 ecr 557599868], length 256
13:58:24.548504 IP lamponubuntu2004-s-1vcpu-1gb-amd-blr1-01.ssh > 162.243.190.66.43113: Flags [P.], seq 233648:233904, ack 193, win 501, options [nop,nop,TS val 3353624775 ecr 557599868], length 256
13:58:24.548540 IP lamponubuntu2004-s-1vcpu-1gb-amd-blr1-01.ssh > 162.243.190.66.43113: Flags [P.], seq 233904:234160, ack 193, win 501, options [nop,nop,TS val 3353624775 ecr 557599868], length 256
13:58:24.548577 IP lamponubuntu2004-s-1vcpu-1gb-amd-blr1-01.ssh > 162.243.190.66.43113: Flags [P.], seq 234160:234416, ack 193, win 501, options [nop,nop,TS val 3353624775 ecr 557599868], length 256
13:58:24.548614 IP lamponubuntu2004-s-1vcpu-1gb-amd-blr1-01.ssh > 162.243.190.66.43113: Flags [P.], seq 234416:234672, ack 193, win 501, options [nop,nop,TS val 3353624775 ecr 557599868], length 256
13:58:24.548648 IP lamponubuntu2004-s-1vcpu-1gb-amd-blr1-01.ssh > 162.243.190.66.43113: Flags [P.], seq 234672:234928, ack 193, win 501, options [nop,nop,TS val 3353624775 ecr 557599868], length 256
13:58:24.548684 IP lamponubuntu2004-s-1vcpu-1gb-amd-blr1-01.ssh > 162.243.190.66.43113: Flags [P.], seq 234928:235184, ack 193, win 501, options [nop,nop,TS val 3353624775 ecr 557599868], length 256
13:58:24.548720 IP lamponubuntu2004-s-1vcpu-1gb-amd-blr1-01.ssh > 162.243.190.66.43113: Flags [P.], seq 235184:235440, ack 193, win 501, options [nop,nop,TS val 3353624775 ecr 557599868], length 256
13:58:24.548757 IP lamponubuntu2004-s-1vcpu-1gb-amd-blr1-01.ssh > 162.243.190.66.43113: Flags [P.], seq 235440:235696, ack 193, win 501, options [nop,nop,TS val 3353624775 ecr 557599868], length 256
13:58:24.548793 IP lamponubuntu2004-s-1vcpu-1gb-amd-blr1-01.ssh > 162.243.190.66.43113: Flags [P.], seq 235696:235952, ack 193, win 501, options [nop,nop,TS val 3353624775 ecr 557599868], length 256
13:58:24.548826 IP lamponubuntu2004-s-1vcpu-1gb-amd-blr1-01.ssh > 162.243.190.66.43113: Flags [P.], seq 235952:236208, ack 193, win 501, options [nop,nop,TS val 3353624775 ecr 557599868], length 256
13:58:24.548862 IP lamponubuntu2004-s-1vcpu-1gb-amd-blr1-01.ssh > 162.243.190.66.43113: Flags [P.], seq 236208:236464, ack 193, win 501, options [nop,nop,TS val 3353624775 ecr 557599868], length 256
13:58:24.548925 IP lamponubuntu2004-s-1vcpu-1gb-amd-blr1-01.ssh > 162.243.190.66.43113: Flags [P.], seq 236464:236720, ack 193, win 501, options [nop,nop,TS val 3353624776 ecr 557599868], length 256
13:58:24.548981 IP lamponubuntu2004-s-1vcpu-1gb-amd-blr1-01.ssh > 162.243.190.66.43113: Flags [P.], seq 236720:236976, ack 193, win 501, options [nop,nop,TS val 3353624776 ecr 557599868], length 256
13:58:24.549019 IP lamponubuntu2004-s-1vcpu-1gb-amd-blr1-01.ssh > 162.243.190.66.43113: Flags [P.], seq 236976:237232, ack 193, win 501, options [nop,nop,TS val 3353624776 ecr 557599868], length 256
13:58:24.549054 IP lamponubuntu2004-s-1vcpu-1gb-amd-blr1-01.ssh > 162.243.190.66.43113: Flags [P.], seq 237232:237488, ack 193, win 501, options [nop,nop,TS val 3353624776 ecr 557599868], length 256
13:58:24.549090 IP lamponubuntu2004-s-1vcpu-1gb-amd-blr1-01.ssh > 162.243.190.66.43113: Flags [P.], seq 237488:237744, ack 193, win 501, options [nop,nop,TS val 3353624776 ecr 557599868], length 256
13:58:24.549161 IP lamponubuntu2004-s-1vcpu-1gb-amd-blr1-01.ssh > 162.243.190.66.43113: Flags [P.], seq 237744:238000, ack 193, win 501, options [nop,nop,TS val 3353624776 ecr 557599868], length 256
13:58:24.549197 IP lamponubuntu2004-s-1vcpu-1gb-amd-blr1-01.ssh > 162.243.190.66.43113: Flags [P.], seq 238000:238256, ack 193, win 501, options [nop,nop,TS val 3353624776 ecr 557599868], length 256
13:58:24.549233 IP lamponubuntu2004-s-1vcpu-1gb-amd-blr1-01.ssh > 162.243.190.66.43113: Flags [P.], seq 238256:238512, ack 193, win 501, options [nop,nop,TS val 3353624776 ecr 557599868], length 256
13:58:24.549268 IP lamponubuntu2004-s-1vcpu-1gb-amd-blr1-01.ssh > 162.243.190.66.43113: Flags [P.], seq 238512:238768, ack 193, win 501, options [nop,nop,TS val 3353624776 ecr 557599868], length 256
13:58:24.549303 IP lamponubuntu2004-s-1vcpu-1gb-amd-blr1-01.ssh > 162.243.190.66.43113: Flags [P.], seq 238768:239024, ack 193, win 501, options [nop,nop,TS val 3353624776 ecr 557599868], length 256
13:58:24.549378 IP lamponubuntu2004-s-1vcpu-1gb-amd-blr1-01.ssh > 162.243.190.66.43113: Flags [P.], seq 239024:239280, ack 193, win 501, options [nop,nop,TS val 3353624776 ecr 557599868], length 256
13:58:24.549423 IP lamponubuntu2004-s-1vcpu-1gb-amd-blr1-01.ssh > 162.243.190.66.43113: Flags [P.], seq 239280:239536, ack 193, win 501, options [nop,nop,TS val 3353624776 ecr 557599868], length 256
13:58:24.549465 IP lamponubuntu2004-s-1vcpu-1gb-amd-blr1-01.ssh > 162.243.190.66.43113: Flags [P.], seq 239536:239792, ack 193, win 501, options [nop,nop,TS val 3353624776 ecr 557599868], length 256
13:58:24.549506 IP lamponubuntu2004-s-1vcpu-1gb-amd-blr1-01.ssh > 162.243.190.66.43113: Flags [P.], seq 239792:240048, ack 193, win 501, options [nop,nop,TS val 3353624776 ecr 557599868], length 256
13:58:24.549546 IP lamponubuntu2004-s-1vcpu-1gb-amd-blr1-01.ssh > 162.243.190.66.43113: Flags [P.], seq 240048:240304, ack 193, win 501, options [nop,nop,TS val 3353624776 ecr 557599868], length 256
13:58:24.549585 IP lamponubuntu2004-s-1vcpu-1gb-amd-blr1-01.ssh > 162.243.190.66.43113: Flags [P.], seq 240304:240560, ack 193, win 501, options [nop,nop,TS val 3353624776 ecr 557599868], length 256
13:58:24.549629 IP lamponubuntu2004-s-1vcpu-1gb-amd-blr1-01.ssh > 162.243.190.66.43113: Flags [P.], seq 240560:240816, ack 193, win 501, options [nop,nop,TS val 3353624776 ecr 557599868], length 256
13:58:24.549669 IP lamponubuntu2004-s-1vcpu-1gb-amd-blr1-01.ssh > 162.243.190.66.43113: Flags [P.], seq 240816:241072, ack 193, win 501, options [nop,nop,TS val 3353624776 ecr 557599868], length 256
13:58:24.549712 IP lamponubuntu2004-s-1vcpu-1gb-amd-blr1-01.ssh > 162.243.190.66.43113: Flags [P.], seq 241072:241328, ack 193, win 501, options [nop,nop,TS val 3353624776 ecr 557599868], length 256
13:58:24.549756 IP lamponubuntu2004-s-1vcpu-1gb-amd-blr1-01.ssh > 162.243.190.66.43113: Flags [P.], seq 241328:241584, ack 193, win 501, options [nop,nop,TS val 3353624776 ecr 557599868], length 256
13:58:24.549795 IP lamponubuntu2004-s-1vcpu-1gb-amd-blr1-01.ssh > 162.243.190.66.43113: Flags [P.], seq 241584:241840, ack 193, win 501, options [nop,nop,TS val 3353624776 ecr 557599868], length 256
13:58:24.549834 IP lamponubuntu2004-s-1vcpu-1gb-amd-blr1-01.ssh > 162.243.190.66.43113: Flags [P.], seq 241840:242096, ack 193, win 501, options [nop,nop,TS val 3353624776 ecr 557599868], length 256
13:58:24.549881 IP lamponubuntu2004-s-1vcpu-1gb-amd-blr1-01.ssh > 162.243.190.66.43113: Flags [P.], seq 242096:242352, ack 193, win 501, options [nop,nop,TS val 3353624777 ecr 557599868], length 256
13:58:24.549949 IP lamponubuntu2004-s-1vcpu-1gb-amd-blr1-01.ssh > 162.243.190.66.43113: Flags [P.], seq 242352:242608, ack 193, win 501, options [nop,nop,TS val 3353624777 ecr 557599868], length 256
13:58:24.549997 IP lamponubuntu2004-s-1vcpu-1gb-amd-blr1-01.ssh > 162.243.190.66.43113: Flags [P.], seq 242608:242864, ack 193, win 501, options [nop,nop,TS val 3353624777 ecr 557599868], length 256
13:58:24.550034 IP lamponubuntu2004-s-1vcpu-1gb-amd-blr1-01.ssh > 162.243.190.66.43113: Flags [P.], seq 242864:243120, ack 193, win 501, options [nop,nop,TS val 3353624777 ecr 557599868], length 256
13:58:24.550090 IP lamponubuntu2004-s-1vcpu-1gb-amd-blr1-01.ssh > 162.243.190.66.43113: Flags [P.], seq 243120:243376, ack 193, win 501, options [nop,nop,TS val 3353624777 ecr 557599868], length 256
13:58:24.550127 IP lamponubuntu2004-s-1vcpu-1gb-amd-blr1-01.ssh > 162.243.190.66.43113: Flags [P.], seq 243376:243632, ack 193, win 501, options [nop,nop,TS val 3353624777 ecr 557599868], length 256
13:58:24.550163 IP lamponubuntu2004-s-1vcpu-1gb-amd-blr1-01.ssh > 162.243.190.66.43113: Flags [P.], seq 243632:243888, ack 193, win 501, options [nop,nop,TS val 3353624777 ecr 557599868], length 256
13:58:24.550198 IP lamponubuntu2004-s-1vcpu-1gb-amd-blr1-01.ssh > 162.243.190.66.43113: Flags [P.], seq 243888:244144, ack 193, win 501, options [nop,nop,TS val 3353624777 ecr 557599868], length 256
13:58:24.550233 IP lamponubuntu2004-s-1vcpu-1gb-amd-blr1-01.ssh > 162.243.190.66.43113: Flags [P.], seq 244144:244400, ack 193, win 501, options [nop,nop,TS val 3353624777 ecr 557599868], length 256
13:58:24.550265 IP lamponubuntu2004-s-1vcpu-1gb-amd-blr1-01.ssh > 162.243.190.66.43113: Flags [P.], seq 244400:244656, ack 193, win 501, options [nop,nop,TS val 3353624777 ecr 557599868], length 256
13:58:24.550303 IP lamponubuntu2004-s-1vcpu-1gb-amd-blr1-01.ssh > 162.243.190.66.43113: Flags [P.], seq 244656:244912, ack 193, win 501, options [nop,nop,TS val 3353624777 ecr 557599868], length 256
13:58:24.550336 IP lamponubuntu2004-s-1vcpu-1gb-amd-blr1-01.ssh > 162.243.190.66.43113: Flags [P.], seq 244912:245168, ack 193, win 501, options [nop,nop,TS val 3353624777 ecr 557599868], length 256
13:58:24.550372 IP lamponubuntu2004-s-1vcpu-1gb-amd-blr1-01.ssh > 162.243.190.66.43113: Flags [P.], seq 245168:245424, ack 193, win 501, options [nop,nop,TS val 3353624777 ecr 557599868], length 256
13:58:24.550425 IP lamponubuntu2004-s-1vcpu-1gb-amd-blr1-01.ssh > 162.243.190.66.43113: Flags [P.], seq 245424:245680, ack 193, win 501, options [nop,nop,TS val 3353624777 ecr 557599868], length 256
13:58:24.550474 IP lamponubuntu2004-s-1vcpu-1gb-amd-blr1-01.ssh > 162.243.190.66.43113: Flags [P.], seq 245680:245936, ack 193, win 501, options [nop,nop,TS val 3353624777 ecr 557599868], length 256
13:58:24.550510 IP lamponubuntu2004-s-1vcpu-1gb-amd-blr1-01.ssh > 162.243.190.66.43113: Flags [P.], seq 245936:246192, ack 193, win 501, options [nop,nop,TS val 3353624777 ecr 557599868], length 256
13:58:24.550548 IP lamponubuntu2004-s-1vcpu-1gb-amd-blr1-01.ssh > 162.243.190.66.43113: Flags [P.], seq 246192:246448, ack 193, win 501, options [nop,nop,TS val 3353624777 ecr 557599868], length 256
13:58:24.550655 IP lamponubuntu2004-s-1vcpu-1gb-amd-blr1-01.ssh > 162.243.190.66.43113: Flags [P.], seq 246448:246704, ack 193, win 501, options [nop,nop,TS val 3353624777 ecr 557599868], length 256
13:58:24.550694 IP lamponubuntu2004-s-1vcpu-1gb-amd-blr1-01.ssh > 162.243.190.66.43113: Flags [P.], seq 246704:246960, ack 193, win 501, options [nop,nop,TS val 3353624777 ecr 557599868], length 256
13:58:24.550728 IP lamponubuntu2004-s-1vcpu-1gb-amd-blr1-01.ssh > 162.243.190.66.43113: Flags [P.], seq 246960:247216, ack 193, win 501, options [nop,nop,TS val 3353624777 ecr 557599868], length 256
13:58:24.550763 IP lamponubuntu2004-s-1vcpu-1gb-amd-blr1-01.ssh > 162.243.190.66.43113: Flags [P.], seq 247216:247472, ack 193, win 501, options [nop,nop,TS val 3353624777 ecr 557599868], length 256
13:58:24.550797 IP lamponubuntu2004-s-1vcpu-1gb-amd-blr1-01.ssh > 162.243.190.66.43113: Flags [P.], seq 247472:247728, ack 193, win 501, options [nop,nop,TS val 3353624777 ecr 557599868], length 256
13:58:24.550833 IP lamponubuntu2004-s-1vcpu-1gb-amd-blr1-01.ssh > 162.243.190.66.43113: Flags [P.], seq 247728:247984, ack 193, win 501, options [nop,nop,TS val 3353624777 ecr 557599868], length 256
13:58:24.550867 IP lamponubuntu2004-s-1vcpu-1gb-amd-blr1-01.ssh > 162.243.190.66.43113: Flags [P.], seq 247984:248240, ack 193, win 501, options [nop,nop,TS val 3353624778 ecr 557599868], length 256
13:58:24.550962 IP lamponubuntu2004-s-1vcpu-1gb-amd-blr1-01.ssh > 162.243.190.66.43113: Flags [P.], seq 248240:248496, ack 193, win 501, options [nop,nop,TS val 3353624778 ecr 557599868], length 256
13:58:24.551011 IP lamponubuntu2004-s-1vcpu-1gb-amd-blr1-01.ssh > 162.243.190.66.43113: Flags [P.], seq 248496:248752, ack 193, win 501, options [nop,nop,TS val 3353624778 ecr 557599868], length 256
13:58:24.551050 IP lamponubuntu2004-s-1vcpu-1gb-amd-blr1-01.ssh > 162.243.190.66.43113: Flags [P.], seq 248752:249008, ack 193, win 501, options [nop,nop,TS val 3353624778 ecr 557599868], length 256
13:58:24.551085 IP lamponubuntu2004-s-1vcpu-1gb-amd-blr1-01.ssh > 162.243.190.66.43113: Flags [P.], seq 249008:249264, ack 193, win 501, options [nop,nop,TS val 3353624778 ecr 557599868], length 256
13:58:24.551125 IP lamponubuntu2004-s-1vcpu-1gb-amd-blr1-01.ssh > 162.243.190.66.43113: Flags [P.], seq 249264:249520, ack 193, win 501, options [nop,nop,TS val 3353624778 ecr 557599868], length 256
13:58:24.551158 IP lamponubuntu2004-s-1vcpu-1gb-amd-blr1-01.ssh > 162.243.190.66.43113: Flags [P.], seq 249520:249776, ack 193, win 501, options [nop,nop,TS val 3353624778 ecr 557599868], length 256
13:58:24.551192 IP lamponubuntu2004-s-1vcpu-1gb-amd-blr1-01.ssh > 162.243.190.66.43113: Flags [P.], seq 249776:250032, ack 193, win 501, options [nop,nop,TS val 3353624778 ecr 557599868], length 256
13:58:24.551226 IP lamponubuntu2004-s-1vcpu-1gb-amd-blr1-01.ssh > 162.243.190.66.43113: Flags [P.], seq 250032:250288, ack 193, win 501, options [nop,nop,TS val 3353624778 ecr 557599868], length 256
13:58:24.551260 IP lamponubuntu2004-s-1vcpu-1gb-amd-blr1-01.ssh > 162.243.190.66.43113: Flags [P.], seq 250288:250544, ack 193, win 501, options [nop,nop,TS val 3353624778 ecr 557599868], length 256
13:58:24.551294 IP lamponubuntu2004-s-1vcpu-1gb-amd-blr1-01.ssh > 162.243.190.66.43113: Flags [P.], seq 250544:250800, ack 193, win 501, options [nop,nop,TS val 3353624778 ecr 557599868], length 256
13:58:24.551329 IP lamponubuntu2004-s-1vcpu-1gb-amd-blr1-01.ssh > 162.243.190.66.43113: Flags [P.], seq 250800:251056, ack 193, win 501, options [nop,nop,TS val 3353624778 ecr 557599868], length 256
13:58:24.551365 IP lamponubuntu2004-s-1vcpu-1gb-amd-blr1-01.ssh > 162.243.190.66.43113: Flags [P.], seq 251056:251312, ack 193, win 501, options [nop,nop,TS val 3353624778 ecr 557599868], length 256
13:58:24.551401 IP lamponubuntu2004-s-1vcpu-1gb-amd-blr1-01.ssh > 162.243.190.66.43113: Flags [P.], seq 251312:251568, ack 193, win 501, options [nop,nop,TS val 3353624778 ecr 557599868], length 256
13:58:24.551433 IP lamponubuntu2004-s-1vcpu-1gb-amd-blr1-01.ssh > 162.243.190.66.43113: Flags [P.], seq 251568:251824, ack 193, win 501, options [nop,nop,TS val 3353624778 ecr 557599868], length 256
13:58:24.551467 IP lamponubuntu2004-s-1vcpu-1gb-amd-blr1-01.ssh > 162.243.190.66.43113: Flags [P.], seq 251824:252080, ack 193, win 501, options [nop,nop,TS val 3353624778 ecr 557599868], length 256
13:58:24.551518 IP lamponubuntu2004-s-1vcpu-1gb-amd-blr1-01.ssh > 162.243.190.66.43113: Flags [P.], seq 252080:252336, ack 193, win 501, options [nop,nop,TS val 3353624778 ecr 557599868], length 256
13:58:24.551569 IP lamponubuntu2004-s-1vcpu-1gb-amd-blr1-01.ssh > 162.243.190.66.43113: Flags [P.], seq 252336:252592, ack 193, win 501, options [nop,nop,TS val 3353624778 ecr 557599868], length 256
13:58:24.551605 IP lamponubuntu2004-s-1vcpu-1gb-amd-blr1-01.ssh > 162.243.190.66.43113: Flags [P.], seq 252592:252848, ack 193, win 501, options [nop,nop,TS val 3353624778 ecr 557599868], length 256
13:58:24.551643 IP lamponubuntu2004-s-1vcpu-1gb-amd-blr1-01.ssh > 162.243.190.66.43113: Flags [P.], seq 252848:253104, ack 193, win 501, options [nop,nop,TS val 3353624778 ecr 557599868], length 256
13:58:24.551676 IP lamponubuntu2004-s-1vcpu-1gb-amd-blr1-01.ssh > 162.243.190.66.43113: Flags [P.], seq 253104:253360, ack 193, win 501, options [nop,nop,TS val 3353624778 ecr 557599868], length 256
13:58:24.551712 IP lamponubuntu2004-s-1vcpu-1gb-amd-blr1-01.ssh > 162.243.190.66.43113: Flags [P.], seq 253360:253616, ack 193, win 501, options [nop,nop,TS val 3353624778 ecr 557599868], length 256
13:58:24.551748 IP lamponubuntu2004-s-1vcpu-1gb-amd-blr1-01.ssh > 162.243.190.66.43113: Flags [P.], seq 253616:253872, ack 193, win 501, options [nop,nop,TS val 3353624778 ecr 557599868], length 256
13:58:24.551782 IP lamponubuntu2004-s-1vcpu-1gb-amd-blr1-01.ssh > 162.243.190.66.43113: Flags [P.], seq 253872:254128, ack 193, win 501, options [nop,nop,TS val 3353624778 ecr 557599868], length 256
13:58:24.551818 IP lamponubuntu2004-s-1vcpu-1gb-amd-blr1-01.ssh > 162.243.190.66.43113: Flags [P.], seq 254128:254384, ack 193, win 501, options [nop,nop,TS val 3353624778 ecr 557599868], length 256
13:58:24.551853 IP lamponubuntu2004-s-1vcpu-1gb-amd-blr1-01.ssh > 162.243.190.66.43113: Flags [P.], seq 254384:254640, ack 193, win 501, options [nop,nop,TS val 3353624778 ecr 557599868], length 256
13:58:24.551886 IP lamponubuntu2004-s-1vcpu-1gb-amd-blr1-01.ssh > 162.243.190.66.43113: Flags [P.], seq 254640:254896, ack 193, win 501, options [nop,nop,TS val 3353624779 ecr 557599868], length 256
13:58:24.551923 IP lamponubuntu2004-s-1vcpu-1gb-amd-blr1-01.ssh > 162.243.190.66.43113: Flags [P.], seq 254896:255152, ack 193, win 501, options [nop,nop,TS val 3353624779 ecr 557599868], length 256
13:58:24.551956 IP lamponubuntu2004-s-1vcpu-1gb-amd-blr1-01.ssh > 162.243.190.66.43113: Flags [P.], seq 255152:255408, ack 193, win 501, options [nop,nop,TS val 3353624779 ecr 557599868], length 256
13:58:24.551991 IP lamponubuntu2004-s-1vcpu-1gb-amd-blr1-01.ssh > 162.243.190.66.43113: Flags [P.], seq 255408:255664, ack 193, win 501, options [nop,nop,TS val 3353624779 ecr 557599868], length 256
13:58:24.552024 IP lamponubuntu2004-s-1vcpu-1gb-amd-blr1-01.ssh > 162.243.190.66.43113: Flags [P.], seq 255664:255920, ack 193, win 501, options [nop,nop,TS val 3353624779 ecr 557599868], length 256
13:58:24.552058 IP lamponubuntu2004-s-1vcpu-1gb-amd-blr1-01.ssh > 162.243.190.66.43113: Flags [P.], seq 255920:256176, ack 193, win 501, options [nop,nop,TS val 3353624779 ecr 557599868], length 256
13:58:24.552091 IP lamponubuntu2004-s-1vcpu-1gb-amd-blr1-01.ssh > 162.243.190.66.43113: Flags [P.], seq 256176:256432, ack 193, win 501, options [nop,nop,TS val 3353624779 ecr 557599868], length 256
13:58:24.552125 IP lamponubuntu2004-s-1vcpu-1gb-amd-blr1-01.ssh > 162.243.190.66.43113: Flags [P.], seq 256432:256688, ack 193, win 501, options [nop,nop,TS val 3353624779 ecr 557599868], length 256
13:58:24.552157 IP lamponubuntu2004-s-1vcpu-1gb-amd-blr1-01.ssh > 162.243.190.66.43113: Flags [P.], seq 256688:256944, ack 193, win 501, options [nop,nop,TS val 3353624779 ecr 557599868], length 256
13:58:24.552193 IP lamponubuntu2004-s-1vcpu-1gb-amd-blr1-01.ssh > 162.243.190.66.43113: Flags [P.], seq 256944:257200, ack 193, win 501, options [nop,nop,TS val 3353624779 ecr 557599868], length 256
13:58:24.552225 IP lamponubuntu2004-s-1vcpu-1gb-amd-blr1-01.ssh > 162.243.190.66.43113: Flags [P.], seq 257200:257456, ack 193, win 501, options [nop,nop,TS val 3353624779 ecr 557599868], length 256
13:58:24.552261 IP lamponubuntu2004-s-1vcpu-1gb-amd-blr1-01.ssh > 162.243.190.66.43113: Flags [P.], seq 257456:257712, ack 193, win 501, options [nop,nop,TS val 3353624779 ecr 557599868], length 256
13:58:24.552298 IP lamponubuntu2004-s-1vcpu-1gb-amd-blr1-01.ssh > 162.243.190.66.43113: Flags [P.], seq 257712:257968, ack 193, win 501, options [nop,nop,TS val 3353624779 ecr 557599868], length 256
13:58:24.552331 IP lamponubuntu2004-s-1vcpu-1gb-amd-blr1-01.ssh > 162.243.190.66.43113: Flags [P.], seq 257968:258224, ack 193, win 501, options [nop,nop,TS val 3353624779 ecr 557599868], length 256
13:58:24.552367 IP lamponubuntu2004-s-1vcpu-1gb-amd-blr1-01.ssh > 162.243.190.66.43113: Flags [P.], seq 258224:258480, ack 193, win 501, options [nop,nop,TS val 3353624779 ecr 557599868], length 256
13:58:24.552401 IP lamponubuntu2004-s-1vcpu-1gb-amd-blr1-01.ssh > 162.243.190.66.43113: Flags [P.], seq 258480:258736, ack 193, win 501, options [nop,nop,TS val 3353624779 ecr 557599868], length 256
13:58:24.552434 IP lamponubuntu2004-s-1vcpu-1gb-amd-blr1-01.ssh > 162.243.190.66.43113: Flags [P.], seq 258736:258992, ack 193, win 501, options [nop,nop,TS val 3353624779 ecr 557599868], length 256
13:58:24.552472 IP lamponubuntu2004-s-1vcpu-1gb-amd-blr1-01.ssh > 162.243.190.66.43113: Flags [P.], seq 258992:259248, ack 193, win 501, options [nop,nop,TS val 3353624779 ecr 557599868], length 256
13:58:24.552509 IP lamponubuntu2004-s-1vcpu-1gb-amd-blr1-01.ssh > 162.243.190.66.43113: Flags [P.], seq 259248:259504, ack 193, win 501, options [nop,nop,TS val 3353624779 ecr 557599868], length 256
13:58:24.552552 IP lamponubuntu2004-s-1vcpu-1gb-amd-blr1-01.ssh > 162.243.190.66.43113: Flags [P.], seq 259504:259760, ack 193, win 501, options [nop,nop,TS val 3353624779 ecr 557599868], length 256
13:58:24.552595 IP lamponubuntu2004-s-1vcpu-1gb-amd-blr1-01.ssh > 162.243.190.66.43113: Flags [P.], seq 259760:260016, ack 193, win 501, options [nop,nop,TS val 3353624779 ecr 557599868], length 256
13:58:24.552635 IP lamponubuntu2004-s-1vcpu-1gb-amd-blr1-01.ssh > 162.243.190.66.43113: Flags [P.], seq 260016:260272, ack 193, win 501, options [nop,nop,TS val 3353624779 ecr 557599868], length 256
13:58:24.552670 IP lamponubuntu2004-s-1vcpu-1gb-amd-blr1-01.ssh > 162.243.190.66.43113: Flags [P.], seq 260272:260528, ack 193, win 501, options [nop,nop,TS val 3353624779 ecr 557599868], length 256
13:58:24.552704 IP lamponubuntu2004-s-1vcpu-1gb-amd-blr1-01.ssh > 162.243.190.66.43113: Flags [P.], seq 260528:260784, ack 193, win 501, options [nop,nop,TS val 3353624779 ecr 557599868], length 256
13:58:24.552737 IP lamponubuntu2004-s-1vcpu-1gb-amd-blr1-01.ssh > 162.243.190.66.43113: Flags [P.], seq 260784:261040, ack 193, win 501, options [nop,nop,TS val 3353624779 ecr 557599868], length 256
13:58:24.552777 IP lamponubuntu2004-s-1vcpu-1gb-amd-blr1-01.ssh > 162.243.190.66.43113: Flags [P.], seq 261040:261296, ack 193, win 501, options [nop,nop,TS val 3353624779 ecr 557599868], length 256
13:58:24.552817 IP lamponubuntu2004-s-1vcpu-1gb-amd-blr1-01.ssh > 162.243.190.66.43113: Flags [P.], seq 261296:261552, ack 193, win 501, options [nop,nop,TS val 3353624779 ecr 557599868], length 256
13:58:24.552852 IP lamponubuntu2004-s-1vcpu-1gb-amd-blr1-01.ssh > 162.243.190.66.43113: Flags [P.], seq 261552:261808, ack 193, win 501, options [nop,nop,TS val 3353624779 ecr 557599868], length 256
13:58:24.552909 IP lamponubuntu2004-s-1vcpu-1gb-amd-blr1-01.ssh > 162.243.190.66.43113: Flags [P.], seq 261808:262064, ack 193, win 501, options [nop,nop,TS val 3353624780 ecr 557599868], length 256
13:58:24.552971 IP lamponubuntu2004-s-1vcpu-1gb-amd-blr1-01.ssh > 162.243.190.66.43113: Flags [P.], seq 262064:262320, ack 193, win 501, options [nop,nop,TS val 3353624780 ecr 557599868], length 256
13:58:24.553014 IP lamponubuntu2004-s-1vcpu-1gb-amd-blr1-01.ssh > 162.243.190.66.43113: Flags [P.], seq 262320:262576, ack 193, win 501, options [nop,nop,TS val 3353624780 ecr 557599868], length 256
13:58:24.553047 IP lamponubuntu2004-s-1vcpu-1gb-amd-blr1-01.ssh > 162.243.190.66.43113: Flags [P.], seq 262576:262832, ack 193, win 501, options [nop,nop,TS val 3353624780 ecr 557599868], length 256
13:58:24.553083 IP lamponubuntu2004-s-1vcpu-1gb-amd-blr1-01.ssh > 162.243.190.66.43113: Flags [P.], seq 262832:263088, ack 193, win 501, options [nop,nop,TS val 3353624780 ecr 557599868], length 256
13:58:24.553148 IP lamponubuntu2004-s-1vcpu-1gb-amd-blr1-01.ssh > 162.243.190.66.43113: Flags [P.], seq 263088:263344, ack 193, win 501, options [nop,nop,TS val 3353624780 ecr 557599868], length 256
13:58:24.553186 IP lamponubuntu2004-s-1vcpu-1gb-amd-blr1-01.ssh > 162.243.190.66.43113: Flags [P.], seq 263344:263600, ack 193, win 501, options [nop,nop,TS val 3353624780 ecr 557599868], length 256
13:58:24.553222 IP lamponubuntu2004-s-1vcpu-1gb-amd-blr1-01.ssh > 162.243.190.66.43113: Flags [P.], seq 263600:263856, ack 193, win 501, options [nop,nop,TS val 3353624780 ecr 557599868], length 256
13:58:24.553257 IP lamponubuntu2004-s-1vcpu-1gb-amd-blr1-01.ssh > 162.243.190.66.43113: Flags [P.], seq 263856:264112, ack 193, win 501, options [nop,nop,TS val 3353624780 ecr 557599868], length 256
13:58:24.553289 IP lamponubuntu2004-s-1vcpu-1gb-amd-blr1-01.ssh > 162.243.190.66.43113: Flags [P.], seq 264112:264368, ack 193, win 501, options [nop,nop,TS val 3353624780 ecr 557599868], length 256
13:58:24.553323 IP lamponubuntu2004-s-1vcpu-1gb-amd-blr1-01.ssh > 162.243.190.66.43113: Flags [P.], seq 264368:264624, ack 193, win 501, options [nop,nop,TS val 3353624780 ecr 557599868], length 256
13:58:24.553356 IP lamponubuntu2004-s-1vcpu-1gb-amd-blr1-01.ssh > 162.243.190.66.43113: Flags [P.], seq 264624:264880, ack 193, win 501, options [nop,nop,TS val 3353624780 ecr 557599868], length 256
13:58:24.553390 IP lamponubuntu2004-s-1vcpu-1gb-amd-blr1-01.ssh > 162.243.190.66.43113: Flags [P.], seq 264880:265136, ack 193, win 501, options [nop,nop,TS val 3353624780 ecr 557599868], length 256
13:58:24.553426 IP lamponubuntu2004-s-1vcpu-1gb-amd-blr1-01.ssh > 162.243.190.66.43113: Flags [P.], seq 265136:265392, ack 193, win 501, options [nop,nop,TS val 3353624780 ecr 557599868], length 256
13:58:24.553460 IP lamponubuntu2004-s-1vcpu-1gb-amd-blr1-01.ssh > 162.243.190.66.43113: Flags [P.], seq 265392:265648, ack 193, win 501, options [nop,nop,TS val 3353624780 ecr 557599868], length 256
13:58:24.553498 IP lamponubuntu2004-s-1vcpu-1gb-amd-blr1-01.ssh > 162.243.190.66.43113: Flags [P.], seq 265648:265904, ack 193, win 501, options [nop,nop,TS val 3353624780 ecr 557599868], length 256
13:58:24.553530 IP lamponubuntu2004-s-1vcpu-1gb-amd-blr1-01.ssh > 162.243.190.66.43113: Flags [P.], seq 265904:266160, ack 193, win 501, options [nop,nop,TS val 3353624780 ecr 557599868], length 256
13:58:24.553564 IP lamponubuntu2004-s-1vcpu-1gb-amd-blr1-01.ssh > 162.243.190.66.43113: Flags [P.], seq 266160:266416, ack 193, win 501, options [nop,nop,TS val 3353624780 ecr 557599868], length 256
13:58:24.553596 IP lamponubuntu2004-s-1vcpu-1gb-amd-blr1-01.ssh > 162.243.190.66.43113: Flags [P.], seq 266416:266672, ack 193, win 501, options [nop,nop,TS val 3353624780 ecr 557599868], length 256
13:58:24.553630 IP lamponubuntu2004-s-1vcpu-1gb-amd-blr1-01.ssh > 162.243.190.66.43113: Flags [P.], seq 266672:266928, ack 193, win 501, options [nop,nop,TS val 3353624780 ecr 557599868], length 256
13:58:24.553665 IP lamponubuntu2004-s-1vcpu-1gb-amd-blr1-01.ssh > 162.243.190.66.43113: Flags [P.], seq 266928:267184, ack 193, win 501, options [nop,nop,TS val 3353624780 ecr 557599868], length 256
13:58:24.553720 IP lamponubuntu2004-s-1vcpu-1gb-amd-blr1-01.ssh > 162.243.190.66.43113: Flags [P.], seq 267184:267440, ack 193, win 501, options [nop,nop,TS val 3353624780 ecr 557599868], length 256
13:58:24.553768 IP lamponubuntu2004-s-1vcpu-1gb-amd-blr1-01.ssh > 162.243.190.66.43113: Flags [P.], seq 267440:267696, ack 193, win 501, options [nop,nop,TS val 3353624780 ecr 557599868], length 256
13:58:24.553806 IP lamponubuntu2004-s-1vcpu-1gb-amd-blr1-01.ssh > 162.243.190.66.43113: Flags [P.], seq 267696:267952, ack 193, win 501, options [nop,nop,TS val 3353624780 ecr 557599868], length 256
13:58:24.553841 IP lamponubuntu2004-s-1vcpu-1gb-amd-blr1-01.ssh > 162.243.190.66.43113: Flags [P.], seq 267952:268208, ack 193, win 501, options [nop,nop,TS val 3353624780 ecr 557599868], length 256
13:58:24.553877 IP lamponubuntu2004-s-1vcpu-1gb-amd-blr1-01.ssh > 162.243.190.66.43113: Flags [P.], seq 268208:268464, ack 193, win 501, options [nop,nop,TS val 3353624781 ecr 557599868], length 256
13:58:24.553910 IP lamponubuntu2004-s-1vcpu-1gb-amd-blr1-01.ssh > 162.243.190.66.43113: Flags [P.], seq 268464:268720, ack 193, win 501, options [nop,nop,TS val 3353624781 ecr 557599868], length 256
13:58:24.553945 IP lamponubuntu2004-s-1vcpu-1gb-amd-blr1-01.ssh > 162.243.190.66.43113: Flags [P.], seq 268720:268976, ack 193, win 501, options [nop,nop,TS val 3353624781 ecr 557599868], length 256
13:58:24.553979 IP lamponubuntu2004-s-1vcpu-1gb-amd-blr1-01.ssh > 162.243.190.66.43113: Flags [P.], seq 268976:269232, ack 193, win 501, options [nop,nop,TS val 3353624781 ecr 557599868], length 256
13:58:24.554016 IP lamponubuntu2004-s-1vcpu-1gb-amd-blr1-01.ssh > 162.243.190.66.43113: Flags [P.], seq 269232:269488, ack 193, win 501, options [nop,nop,TS val 3353624781 ecr 557599868], length 256
13:58:24.554052 IP lamponubuntu2004-s-1vcpu-1gb-amd-blr1-01.ssh > 162.243.190.66.43113: Flags [P.], seq 269488:269744, ack 193, win 501, options [nop,nop,TS val 3353624781 ecr 557599868], length 256
13:58:24.554090 IP lamponubuntu2004-s-1vcpu-1gb-amd-blr1-01.ssh > 162.243.190.66.43113: Flags [P.], seq 269744:270000, ack 193, win 501, options [nop,nop,TS val 3353624781 ecr 557599868], length 256
13:58:24.554125 IP lamponubuntu2004-s-1vcpu-1gb-amd-blr1-01.ssh > 162.243.190.66.43113: Flags [P.], seq 270000:270256, ack 193, win 501, options [nop,nop,TS val 3353624781 ecr 557599868], length 256
13:58:24.554158 IP lamponubuntu2004-s-1vcpu-1gb-amd-blr1-01.ssh > 162.243.190.66.43113: Flags [P.], seq 270256:270512, ack 193, win 501, options [nop,nop,TS val 3353624781 ecr 557599868], length 256
13:58:24.554231 IP lamponubuntu2004-s-1vcpu-1gb-amd-blr1-01.ssh > 162.243.190.66.43113: Flags [P.], seq 270512:270768, ack 193, win 501, options [nop,nop,TS val 3353624781 ecr 557599868], length 256
13:58:24.554266 IP lamponubuntu2004-s-1vcpu-1gb-amd-blr1-01.ssh > 162.243.190.66.43113: Flags [P.], seq 270768:271024, ack 193, win 501, options [nop,nop,TS val 3353624781 ecr 557599868], length 256
13:58:24.554300 IP lamponubuntu2004-s-1vcpu-1gb-amd-blr1-01.ssh > 162.243.190.66.43113: Flags [P.], seq 271024:271280, ack 193, win 501, options [nop,nop,TS val 3353624781 ecr 557599868], length 256
13:58:24.554335 IP lamponubuntu2004-s-1vcpu-1gb-amd-blr1-01.ssh > 162.243.190.66.43113: Flags [P.], seq 271280:271536, ack 193, win 501, options [nop,nop,TS val 3353624781 ecr 557599868], length 256
13:58:24.554370 IP lamponubuntu2004-s-1vcpu-1gb-amd-blr1-01.ssh > 162.243.190.66.43113: Flags [P.], seq 271536:271792, ack 193, win 501, options [nop,nop,TS val 3353624781 ecr 557599868], length 256
13:58:24.554405 IP lamponubuntu2004-s-1vcpu-1gb-amd-blr1-01.ssh > 162.243.190.66.43113: Flags [P.], seq 271792:272048, ack 193, win 501, options [nop,nop,TS val 3353624781 ecr 557599868], length 256
13:58:24.554465 IP lamponubuntu2004-s-1vcpu-1gb-amd-blr1-01.ssh > 162.243.190.66.43113: Flags [P.], seq 272048:272304, ack 193, win 501, options [nop,nop,TS val 3353624781 ecr 557599868], length 256
13:58:24.554501 IP lamponubuntu2004-s-1vcpu-1gb-amd-blr1-01.ssh > 162.243.190.66.43113: Flags [P.], seq 272304:272560, ack 193, win 501, options [nop,nop,TS val 3353624781 ecr 557599868], length 256
13:58:24.554536 IP lamponubuntu2004-s-1vcpu-1gb-amd-blr1-01.ssh > 162.243.190.66.43113: Flags [P.], seq 272560:272816, ack 193, win 501, options [nop,nop,TS val 3353624781 ecr 557599868], length 256
13:58:24.554569 IP lamponubuntu2004-s-1vcpu-1gb-amd-blr1-01.ssh > 162.243.190.66.43113: Flags [P.], seq 272816:273072, ack 193, win 501, options [nop,nop,TS val 3353624781 ecr 557599868], length 256
13:58:24.554602 IP lamponubuntu2004-s-1vcpu-1gb-amd-blr1-01.ssh > 162.243.190.66.43113: Flags [P.], seq 273072:273328, ack 193, win 501, options [nop,nop,TS val 3353624781 ecr 557599868], length 256
13:58:24.554661 IP lamponubuntu2004-s-1vcpu-1gb-amd-blr1-01.ssh > 162.243.190.66.43113: Flags [P.], seq 273328:273584, ack 193, win 501, options [nop,nop,TS val 3353624781 ecr 557599868], length 256
13:58:24.554699 IP lamponubuntu2004-s-1vcpu-1gb-amd-blr1-01.ssh > 162.243.190.66.43113: Flags [P.], seq 273584:273840, ack 193, win 501, options [nop,nop,TS val 3353624781 ecr 557599868], length 256
13:58:24.554736 IP lamponubuntu2004-s-1vcpu-1gb-amd-blr1-01.ssh > 162.243.190.66.43113: Flags [P.], seq 273840:274096, ack 193, win 501, options [nop,nop,TS val 3353624781 ecr 557599868], length 256
13:58:24.554772 IP lamponubuntu2004-s-1vcpu-1gb-amd-blr1-01.ssh > 162.243.190.66.43113: Flags [P.], seq 274096:274352, ack 193, win 501, options [nop,nop,TS val 3353624781 ecr 557599868], length 256
13:58:24.554816 IP lamponubuntu2004-s-1vcpu-1gb-amd-blr1-01.ssh > 162.243.190.66.43113: Flags [P.], seq 274352:274608, ack 193, win 501, options [nop,nop,TS val 3353624781 ecr 557599868], length 256
13:58:24.568836 IP 162.243.190.66.43113 > lamponubuntu2004-s-1vcpu-1gb-amd-blr1-01.ssh: Flags [.], ack 146832, win 2005, options [nop,nop,TS val 557599889 ecr 3353624479], length 0
13:58:24.568912 IP lamponubuntu2004-s-1vcpu-1gb-amd-blr1-01.ssh > 162.243.190.66.43113: Flags [P.], seq 274608:274864, ack 193, win 501, options [nop,nop,TS val 3353624796 ecr 557599889], length 256
13:58:24.568970 IP 162.243.190.66.43113 > lamponubuntu2004-s-1vcpu-1gb-amd-blr1-01.ssh: Flags [.], ack 148496, win 2005, options [nop,nop,TS val 557599889 ecr 3353624500], length 0
13:58:24.569012 IP 162.243.190.66.43113 > lamponubuntu2004-s-1vcpu-1gb-amd-blr1-01.ssh: Flags [.], ack 149616, win 2005, options [nop,nop,TS val 557599889 ecr 3353624500], length 0
13:58:24.569143 IP 162.243.190.66.43113 > lamponubuntu2004-s-1vcpu-1gb-amd-blr1-01.ssh: Flags [.], ack 150736, win 2005, options [nop,nop,TS val 557599889 ecr 3353624500], length 0
13:58:24.569192 IP lamponubuntu2004-s-1vcpu-1gb-amd-blr1-01.ssh > 162.243.190.66.43113: Flags [P.], seq 274864:275664, ack 193, win 501, options [nop,nop,TS val 3353624796 ecr 557599889], length 800
13:58:24.569254 IP lamponubuntu2004-s-1vcpu-1gb-amd-blr1-01.ssh > 162.243.190.66.43113: Flags [P.], seq 275664:276096, ack 193, win 501, options [nop,nop,TS val 3353624796 ecr 557599889], length 432
13:58:24.569296 IP lamponubuntu2004-s-1vcpu-1gb-amd-blr1-01.ssh > 162.243.190.66.43113: Flags [P.], seq 276096:276352, ack 193, win 501, options [nop,nop,TS val 3353624796 ecr 557599889], length 256
13:58:24.569335 IP lamponubuntu2004-s-1vcpu-1gb-amd-blr1-01.ssh > 162.243.190.66.43113: Flags [P.], seq 276352:276608, ack 193, win 501, options [nop,nop,TS val 3353624796 ecr 557599889], length 256
13:58:24.569376 IP lamponubuntu2004-s-1vcpu-1gb-amd-blr1-01.ssh > 162.243.190.66.43113: Flags [P.], seq 276608:276864, ack 193, win 501, options [nop,nop,TS val 3353624796 ecr 557599889], length 256
13:58:24.569416 IP lamponubuntu2004-s-1vcpu-1gb-amd-blr1-01.ssh > 162.243.190.66.43113: Flags [P.], seq 276864:277120, ack 193, win 501, options [nop,nop,TS val 3353624796 ecr 557599889], length 256
13:58:24.569459 IP lamponubuntu2004-s-1vcpu-1gb-amd-blr1-01.ssh > 162.243.190.66.43113: Flags [P.], seq 277120:277376, ack 193, win 501, options [nop,nop,TS val 3353624796 ecr 557599889], length 256
13:58:24.569496 IP lamponubuntu2004-s-1vcpu-1gb-amd-blr1-01.ssh > 162.243.190.66.43113: Flags [P.], seq 277376:277632, ack 193, win 501, options [nop,nop,TS val 3353624796 ecr 557599889], length 256
