root@lamponubuntu2004-s-1vcpu-1gb-amd-blr1-01:~# tcpdump -c 6 -i eth0 port 22
tcpdump: verbose output suppressed, use -v or -vv for full protocol decode
listening on eth0, link-type EN10MB (Ethernet), capture size 262144 bytes
14:06:49.174709 IP lamponubuntu2004-s-1vcpu-1gb-amd-blr1-01.ssh > 162.243.190.66.43113: Flags [P.], seq 2849531648:2849531712, ack 1582237494, win 501, options [nop,nop,TS val 3354129401 ecr 558104497], length 64
14:06:49.176563 IP lamponubuntu2004-s-1vcpu-1gb-amd-blr1-01.ssh > 162.243.190.66.43113: Flags [P.], seq 64:192, ack 1, win 501, options [nop,nop,TS val 3354129403 ecr 558104497], length 128
14:06:49.176601 IP lamponubuntu2004-s-1vcpu-1gb-amd-blr1-01.ssh > 162.243.190.66.43113: Flags [P.], seq 192:256, ack 1, win 501, options [nop,nop,TS val 3354129403 ecr 558104497], length 64
14:06:49.176668 IP lamponubuntu2004-s-1vcpu-1gb-amd-blr1-01.ssh > 162.243.190.66.43113: Flags [P.], seq 256:384, ack 1, win 501, options [nop,nop,TS val 3354129403 ecr 558104497], length 128
14:06:49.176700 IP lamponubuntu2004-s-1vcpu-1gb-amd-blr1-01.ssh > 162.243.190.66.43113: Flags [P.], seq 384:448, ack 1, win 501, options [nop,nop,TS val 3354129403 ecr 558104497], length 64
14:06:49.179810 IP lamponubuntu2004-s-1vcpu-1gb-amd-blr1-01.ssh > 162.243.190.66.43113: Flags [P.], seq 448:720, ack 1, win 501, options [nop,nop,TS val 3354129406 ecr 558104497], length 272
6 packets captured
8 packets received by filter
0 packets dropped by kernel