root@lamponubuntu2004-s-1vcpu-1gb-amd-blr1-01:~# tcpdump -c 6 -n -i eth0
tcpdump: verbose output suppressed, use -v or -vv for full protocol decode
listening on eth0, link-type EN10MB (Ethernet), capture size 262144 bytes
14:05:31.096008 IP 165.232.177.49.22 > 162.243.190.66.43113: Flags [P.], seq 2849523568:2849523696, ack 1582235126, win 501, options [nop,nop,TS val 3354051323 ecr 558026414], length 128
14:05:31.096046 IP 165.232.177.49.22 > 162.243.190.66.43113: Flags [P.], seq 128:192, ack 1, win 501, options [nop,nop,TS val 3354051323 ecr 558026414], length 64
14:05:31.096073 IP 165.232.177.49.22 > 162.243.190.66.43113: Flags [P.], seq 192:320, ack 1, win 501, options [nop,nop,TS val 3354051323 ecr 558026414], length 128
14:05:31.096241 IP 165.232.177.49.22 > 162.243.190.66.43113: Flags [P.], seq 320:384, ack 1, win 501, options [nop,nop,TS val 3354051323 ecr 558026414], length 64
14:05:31.097420 IP 165.232.177.49.22 > 162.243.190.66.43113: Flags [P.], seq 384:624, ack 1, win 501, options [nop,nop,TS val 3354051324 ecr 558026414], length 240
14:05:31.097460 IP 165.232.177.49.22 > 162.243.190.66.43113: Flags [P.], seq 624:688, ack 1, win 501, options [nop,nop,TS val 3354051324 ecr 558026414], length 64
6 packets captured
10 packets received by filter
0 packets dropped by kernel