root@lamponubuntu2004-s-1vcpu-1gb-amd-blr1-01:~# tcpdump -c 6 -i eth0
tcpdump: verbose output suppressed, use -v or -vv for full protocol decode
listening on eth0, link-type EN10MB (Ethernet), capture size 262144 bytes
13:59:38.326715 IP lamponubuntu2004-s-1vcpu-1gb-amd-blr1-01.ssh > 162.243.190.66.43113: Flags [P.], seq 2844704880:2844704944, ack 1582218486, win 501, options [nop,nop,TS val 3353698553 ecr 557673644], length 64
13:59:38.327338 IP lamponubuntu2004-s-1vcpu-1gb-amd-blr1-01.ssh > 162.243.190.66.43113: Flags [P.], seq 64:192, ack 1, win 501, options [nop,nop,TS val 3353698554 ecr 557673644], length 128
13:59:38.327370 IP lamponubuntu2004-s-1vcpu-1gb-amd-blr1-01.ssh > 162.243.190.66.43113: Flags [P.], seq 192:256, ack 1, win 501, options [nop,nop,TS val 3353698554 ecr 557673644], length 64
13:59:38.327400 IP lamponubuntu2004-s-1vcpu-1gb-amd-blr1-01.ssh > 162.243.190.66.43113: Flags [P.], seq 256:384, ack 1, win 501, options [nop,nop,TS val 3353698554 ecr 557673644], length 128
13:59:38.327421 IP lamponubuntu2004-s-1vcpu-1gb-amd-blr1-01.ssh > 162.243.190.66.43113: Flags [P.], seq 384:448, ack 1, win 501, options [nop,nop,TS val 3353698554 ecr 557673644], length 64
13:59:38.327814 IP lamponubuntu2004-s-1vcpu-1gb-amd-blr1-01.52800 > 67.207.67.2.domain: 24229+ [1au] PTR? 66.190.243.162.in-addr.arpa. (56)
6 packets captured
46 packets received by filter
9 packets dropped by kernel